{
  "citation": {
    "char_end": 180,
    "char_start": 0,
    "corpus_version": "vehiculos-demo-2026-07-20",
    "fragment_id": "frag_12",
    "is_active": true,
    "source_id": "src_licencias_v3",
    "source_version": "3",
    "valid_from": "2026-01-01",
    "valid_to": null
  },
  "fragment_id": "frag_12",
  "fused_score": 0.91,
  "injection_signals": [],
  "lexical_score": 0.72,
  "source_id": "src_licencias_v3",
  "text": "Presentar identificación oficial vigente y comprobante de pago.",
  "title": "Renovación de licencia — versión demo 3",
  "vector_score": 0.88
}
